{
  "$schema": "https://json-schema.org/draft/2020-12/schema",
  "title": "DomainKnowledgePack",
  "type": "object",
  "required": [
    "domain",
    "business_rules",
    "edge_cases",
    "open_questions",
    "assumptions"
  ],
  "properties": {
    "domain": {
      "type": "string"
    },
    "glossary": {
      "type": "array",
      "items": {
        "type": "object",
        "required": [
          "term",
          "definition"
        ],
        "properties": {
          "term": {
            "type": "string"
          },
          "definition": {
            "type": "string"
          }
        }
      }
    },
    "business_rules": {
      "type": "array",
      "items": {
        "type": "string"
      }
    },
    "calculations_or_formulas": {
      "type": "array",
      "items": {
        "type": "string"
      }
    },
    "invariants": {
      "type": "array",
      "items": {
        "type": "string"
      }
    },
    "edge_cases": {
      "type": "array",
      "items": {
        "type": "string"
      }
    },
    "compliance_requirements": {
      "type": "array",
      "items": {
        "type": "string"
      }
    },
    "acceptance_criteria_suggestions": {
      "type": "array",
      "items": {
        "type": "string"
      }
    },
    "open_questions": {
      "type": "array",
      "items": {
        "type": "string"
      }
    },
    "assumptions": {
      "type": "array",
      "items": {
        "type": "string"
      }
    },
    "confidence": {
      "type": "string",
      "enum": [
        "low",
        "medium",
        "high"
      ]
    }
  }
}